
*** Running vivado
    with args -log uP16_BASYS3_top.vdi -applog -m64 -product Vivado -messageDb vivado.pb -mode batch -source uP16_BASYS3_top.tcl -notrace


****** Vivado v2018.3 (64-bit)
  **** SW Build 2405991 on Thu Dec  6 23:38:27 MST 2018
  **** IP Build 2404404 on Fri Dec  7 01:43:56 MST 2018
    ** Copyright 1986-2018 Xilinx, Inc. All Rights Reserved.

source uP16_BASYS3_top.tcl -notrace
Command: link_design -top uP16_BASYS3_top -part xc7a35tcpg236-1
Design is defaulting to srcset: sources_1
Design is defaulting to constrset: constrs_1
INFO: [Netlist 29-17] Analyzing 68 Unisim elements for replacement
INFO: [Netlist 29-28] Unisim Transformation completed in 0 CPU seconds
INFO: [Project 1-479] Netlist was created with Vivado 2018.3
INFO: [Device 21-403] Loading part xc7a35tcpg236-1
INFO: [Project 1-570] Preparing netlist for logic optimization
Parsing XDC File [C:/Users/c170095/Downloads/Lab5/Lab5/Source Codes/uP16_BASYS3_top.xdc]
Finished Parsing XDC File [C:/Users/c170095/Downloads/Lab5/Lab5/Source Codes/uP16_BASYS3_top.xdc]
INFO: [Opt 31-138] Pushed 0 inverter(s) to 0 load pin(s).
Netlist sorting complete. Time (s): cpu = 00:00:00 ; elapsed = 00:00:00 . Memory (MB): peak = 644.602 ; gain = 0.000
INFO: [Project 1-111] Unisim Transformation Summary:
No Unisim elements were transformed.

7 Infos, 0 Warnings, 0 Critical Warnings and 0 Errors encountered.
link_design completed successfully
link_design: Time (s): cpu = 00:00:08 ; elapsed = 00:00:09 . Memory (MB): peak = 648.617 ; gain = 322.234
Command: opt_design
Attempting to get a license for feature 'Implementation' and/or device 'xc7a35t'
INFO: [Common 17-349] Got license for feature 'Implementation' and/or device 'xc7a35t'
Running DRC as a precondition to command opt_design

Starting DRC Task
INFO: [DRC 23-27] Running DRC with 2 threads
INFO: [Project 1-461] DRC finished with 0 Errors
INFO: [Project 1-462] Please refer to the DRC report (report_drc) for more information.

Time (s): cpu = 00:00:01 ; elapsed = 00:00:01 . Memory (MB): peak = 655.773 ; gain = 7.156

Starting Cache Timing Information Task
INFO: [Timing 38-35] Done setting XDC timing constraints.
Ending Cache Timing Information Task | Checksum: 17e97d0ba

Time (s): cpu = 00:00:13 ; elapsed = 00:00:13 . Memory (MB): peak = 1210.148 ; gain = 554.375

Starting Logic Optimization Task

Phase 1 Retarget
INFO: [Opt 31-138] Pushed 0 inverter(s) to 0 load pin(s).
INFO: [Opt 31-49] Retargeted 0 cell(s).
Phase 1 Retarget | Checksum: b99bc303

Time (s): cpu = 00:00:00 ; elapsed = 00:00:00.155 . Memory (MB): peak = 1303.551 ; gain = 0.000
INFO: [Opt 31-389] Phase Retarget created 0 cells and removed 1 cells

Phase 2 Constant propagation
INFO: [Opt 31-138] Pushed 0 inverter(s) to 0 load pin(s).
Phase 2 Constant propagation | Checksum: b99bc303

Time (s): cpu = 00:00:00 ; elapsed = 00:00:00.176 . Memory (MB): peak = 1303.551 ; gain = 0.000
INFO: [Opt 31-389] Phase Constant propagation created 0 cells and removed 0 cells

Phase 3 Sweep
Phase 3 Sweep | Checksum: 12e2ed906

Time (s): cpu = 00:00:00 ; elapsed = 00:00:00.224 . Memory (MB): peak = 1303.551 ; gain = 0.000
INFO: [Opt 31-389] Phase Sweep created 0 cells and removed 0 cells

Phase 4 BUFG optimization
Phase 4 BUFG optimization | Checksum: 12e2ed906

Time (s): cpu = 00:00:00 ; elapsed = 00:00:00.255 . Memory (MB): peak = 1303.551 ; gain = 0.000
INFO: [Opt 31-662] Phase BUFG optimization created 0 cells of which 0 are BUFGs and removed 0 cells.

Phase 5 Shift Register Optimization
Phase 5 Shift Register Optimization | Checksum: 1668a64e0

Time (s): cpu = 00:00:00 ; elapsed = 00:00:00.351 . Memory (MB): peak = 1303.551 ; gain = 0.000
INFO: [Opt 31-389] Phase Shift Register Optimization created 0 cells and removed 0 cells

Phase 6 Post Processing Netlist
Phase 6 Post Processing Netlist | Checksum: 1668a64e0

Time (s): cpu = 00:00:00 ; elapsed = 00:00:00.360 . Memory (MB): peak = 1303.551 ; gain = 0.000
INFO: [Opt 31-389] Phase Post Processing Netlist created 0 cells and removed 0 cells
Opt_design Change Summary
=========================


-------------------------------------------------------------------------------------------------------------------------
|  Phase                        |  #Cells created  |  #Cells Removed  |  #Constrained objects preventing optimizations  |
-------------------------------------------------------------------------------------------------------------------------
|  Retarget                     |               0  |               1  |                                              0  |
|  Constant propagation         |               0  |               0  |                                              0  |
|  Sweep                        |               0  |               0  |                                              0  |
|  BUFG optimization            |               0  |               0  |                                              0  |
|  Shift Register Optimization  |               0  |               0  |                                              0  |
|  Post Processing Netlist      |               0  |               0  |                                              0  |
-------------------------------------------------------------------------------------------------------------------------



Starting Connectivity Check Task

Time (s): cpu = 00:00:00 ; elapsed = 00:00:00.002 . Memory (MB): peak = 1303.551 ; gain = 0.000
Ending Logic Optimization Task | Checksum: 1668a64e0

Time (s): cpu = 00:00:00 ; elapsed = 00:00:00.370 . Memory (MB): peak = 1303.551 ; gain = 0.000

Starting Power Optimization Task
INFO: [Pwropt 34-132] Skipping clock gating for clocks with a period < 2.00 ns.
INFO: [Timing 38-35] Done setting XDC timing constraints.
INFO: [Pwropt 34-9] Applying IDT optimizations ...
INFO: [Pwropt 34-10] Applying ODC optimizations ...
INFO: [Physopt 32-619] Estimated Timing Summary | WNS=6.986 | TNS=0.000 |
Running Vector-less Activity Propagation...

Finished Running Vector-less Activity Propagation


Starting PowerOpt Patch Enables Task
INFO: [Pwropt 34-162] WRITE_MODE attribute of 0 BRAM(s) out of a total of 2 has been updated to save power. Run report_power_opt to get a complete listing of the BRAMs updated.
INFO: [Pwropt 34-201] Structural ODC has moved 0 WE to EN ports
Number of BRAM Ports augmented: 0 newly gated: 0 Total Ports: 4
Ending PowerOpt Patch Enables Task | Checksum: 1668a64e0

Time (s): cpu = 00:00:00 ; elapsed = 00:00:00.023 . Memory (MB): peak = 1427.039 ; gain = 0.000
Ending Power Optimization Task | Checksum: 1668a64e0

Time (s): cpu = 00:00:01 ; elapsed = 00:00:01 . Memory (MB): peak = 1427.039 ; gain = 123.488

Starting Final Cleanup Task
Ending Final Cleanup Task | Checksum: 1668a64e0

Time (s): cpu = 00:00:00 ; elapsed = 00:00:00 . Memory (MB): peak = 1427.039 ; gain = 0.000

Starting Netlist Obfuscation Task
Netlist sorting complete. Time (s): cpu = 00:00:00 ; elapsed = 00:00:00 . Memory (MB): peak = 1427.039 ; gain = 0.000
Ending Netlist Obfuscation Task | Checksum: 1668a64e0

Time (s): cpu = 00:00:00 ; elapsed = 00:00:00.001 . Memory (MB): peak = 1427.039 ; gain = 0.000
INFO: [Common 17-83] Releasing license: Implementation
29 Infos, 0 Warnings, 0 Critical Warnings and 0 Errors encountered.
opt_design completed successfully
opt_design: Time (s): cpu = 00:00:17 ; elapsed = 00:00:17 . Memory (MB): peak = 1427.039 ; gain = 778.422
Netlist sorting complete. Time (s): cpu = 00:00:00 ; elapsed = 00:00:00 . Memory (MB): peak = 1427.039 ; gain = 0.000
INFO: [Timing 38-480] Writing timing data to binary archive.
Writing placer database...
Writing XDEF routing.
Writing XDEF routing logical nets.
Writing XDEF routing special nets.
Write XDEF Complete: Time (s): cpu = 00:00:00 ; elapsed = 00:00:00.073 . Memory (MB): peak = 1427.039 ; gain = 0.000
Netlist sorting complete. Time (s): cpu = 00:00:00 ; elapsed = 00:00:00.001 . Memory (MB): peak = 1427.039 ; gain = 0.000
INFO: [Common 17-1381] The checkpoint 'C:/Users/c170095/Downloads/Lab5/Lab5/Lab 5/Lab 5.runs/impl_1/uP16_BASYS3_top_opt.dcp' has been generated.
INFO: [runtcl-4] Executing : report_drc -file uP16_BASYS3_top_drc_opted.rpt -pb uP16_BASYS3_top_drc_opted.pb -rpx uP16_BASYS3_top_drc_opted.rpx
Command: report_drc -file uP16_BASYS3_top_drc_opted.rpt -pb uP16_BASYS3_top_drc_opted.pb -rpx uP16_BASYS3_top_drc_opted.rpx
INFO: [IP_Flow 19-234] Refreshing IP repositories
INFO: [IP_Flow 19-1704] No user IP repositories specified
INFO: [IP_Flow 19-2313] Loaded Vivado IP repository 'C:/Xilinx/Vivado/2018.3/data/ip'.
INFO: [DRC 23-27] Running DRC with 2 threads
INFO: [Coretcl 2-168] The results of DRC are in file C:/Users/c170095/Downloads/Lab5/Lab5/Lab 5/Lab 5.runs/impl_1/uP16_BASYS3_top_drc_opted.rpt.
report_drc completed successfully
report_drc: Time (s): cpu = 00:00:06 ; elapsed = 00:00:06 . Memory (MB): peak = 1427.039 ; gain = 0.000
Command: place_design
Attempting to get a license for feature 'Implementation' and/or device 'xc7a35t'
INFO: [Common 17-349] Got license for feature 'Implementation' and/or device 'xc7a35t'
INFO: [DRC 23-27] Running DRC with 2 threads
INFO: [Vivado_Tcl 4-198] DRC finished with 0 Errors
INFO: [Vivado_Tcl 4-199] Please refer to the DRC report (report_drc) for more information.
Running DRC as a precondition to command place_design
INFO: [DRC 23-27] Running DRC with 2 threads
INFO: [Vivado_Tcl 4-198] DRC finished with 0 Errors
INFO: [Vivado_Tcl 4-199] Please refer to the DRC report (report_drc) for more information.

Starting Placer Task
INFO: [Place 30-611] Multithreading enabled for place_design using a maximum of 2 CPUs

Phase 1 Placer Initialization

Phase 1.1 Placer Initialization Netlist Sorting
Netlist sorting complete. Time (s): cpu = 00:00:00 ; elapsed = 00:00:00.001 . Memory (MB): peak = 1427.039 ; gain = 0.000
Phase 1.1 Placer Initialization Netlist Sorting | Checksum: faa1654f

Time (s): cpu = 00:00:00 ; elapsed = 00:00:00.104 . Memory (MB): peak = 1427.039 ; gain = 0.000
Netlist sorting complete. Time (s): cpu = 00:00:00 ; elapsed = 00:00:00 . Memory (MB): peak = 1427.039 ; gain = 0.000

Phase 1.2 IO Placement/ Clock Placement/ Build Placer Device
INFO: [Timing 38-35] Done setting XDC timing constraints.
Phase 1.2 IO Placement/ Clock Placement/ Build Placer Device | Checksum: 17108be24

Time (s): cpu = 00:00:02 ; elapsed = 00:00:01 . Memory (MB): peak = 1427.039 ; gain = 0.000

Phase 1.3 Build Placer Netlist Model
Phase 1.3 Build Placer Netlist Model | Checksum: 227dae459

Time (s): cpu = 00:00:02 ; elapsed = 00:00:02 . Memory (MB): peak = 1427.039 ; gain = 0.000

Phase 1.4 Constrain Clocks/Macros
Phase 1.4 Constrain Clocks/Macros | Checksum: 227dae459

Time (s): cpu = 00:00:02 ; elapsed = 00:00:02 . Memory (MB): peak = 1427.039 ; gain = 0.000
Phase 1 Placer Initialization | Checksum: 227dae459

Time (s): cpu = 00:00:02 ; elapsed = 00:00:02 . Memory (MB): peak = 1427.039 ; gain = 0.000

Phase 2 Global Placement

Phase 2.1 Floorplanning
Phase 2.1 Floorplanning | Checksum: 219302a37

Time (s): cpu = 00:00:02 ; elapsed = 00:00:02 . Memory (MB): peak = 1427.039 ; gain = 0.000

Phase 2.2 Physical Synthesis In Placer
INFO: [Physopt 32-65] No nets found for high-fanout optimization.
INFO: [Physopt 32-232] Optimized 0 net. Created 0 new instance.
INFO: [Physopt 32-775] End 1 Pass. Optimized 0 net or cell. Created 0 new cell, deleted 0 existing cell and moved 0 existing cell
INFO: [Physopt 32-670] No setup violation found.  DSP Register Optimization was not performed.
INFO: [Physopt 32-670] No setup violation found.  Shift Register Optimization was not performed.
INFO: [Physopt 32-670] No setup violation found.  BRAM Register Optimization was not performed.
INFO: [Physopt 32-949] No candidate nets found for HD net replication
INFO: [Physopt 32-775] End 1 Pass. Optimized 0 net or cell. Created 0 new cell, deleted 0 existing cell and moved 0 existing cell
Netlist sorting complete. Time (s): cpu = 00:00:00 ; elapsed = 00:00:00 . Memory (MB): peak = 1427.039 ; gain = 0.000

Summary of Physical Synthesis Optimizations
============================================


----------------------------------------------------------------------------------------------------------------------------------------
|  Optimization                  |  Added Cells  |  Removed Cells  |  Optimized Cells/Nets  |  Dont Touch  |  Iterations  |  Elapsed   |
----------------------------------------------------------------------------------------------------------------------------------------
|  Very High Fanout              |            0  |              0  |                     0  |           0  |           1  |  00:00:00  |
|  DSP Register                  |            0  |              0  |                     0  |           0  |           0  |  00:00:00  |
|  Shift Register                |            0  |              0  |                     0  |           0  |           0  |  00:00:00  |
|  BRAM Register                 |            0  |              0  |                     0  |           0  |           0  |  00:00:00  |
|  HD Interface Net Replication  |            0  |              0  |                     0  |           0  |           1  |  00:00:00  |
|  Total                         |            0  |              0  |                     0  |           0  |           2  |  00:00:00  |
----------------------------------------------------------------------------------------------------------------------------------------


Phase 2.2 Physical Synthesis In Placer | Checksum: 1db515059

Time (s): cpu = 00:00:05 ; elapsed = 00:00:04 . Memory (MB): peak = 1427.039 ; gain = 0.000
Phase 2 Global Placement | Checksum: 1f0a97b62

Time (s): cpu = 00:00:05 ; elapsed = 00:00:04 . Memory (MB): peak = 1427.039 ; gain = 0.000

Phase 3 Detail Placement

Phase 3.1 Commit Multi Column Macros
Phase 3.1 Commit Multi Column Macros | Checksum: 1f0a97b62

Time (s): cpu = 00:00:05 ; elapsed = 00:00:04 . Memory (MB): peak = 1427.039 ; gain = 0.000

Phase 3.2 Commit Most Macros & LUTRAMs
Phase 3.2 Commit Most Macros & LUTRAMs | Checksum: 158f42498

Time (s): cpu = 00:00:05 ; elapsed = 00:00:04 . Memory (MB): peak = 1427.039 ; gain = 0.000

Phase 3.3 Area Swap Optimization
Phase 3.3 Area Swap Optimization | Checksum: d239f973

Time (s): cpu = 00:00:05 ; elapsed = 00:00:04 . Memory (MB): peak = 1427.039 ; gain = 0.000

Phase 3.4 Pipeline Register Optimization
Phase 3.4 Pipeline Register Optimization | Checksum: 14ff6c6a0

Time (s): cpu = 00:00:05 ; elapsed = 00:00:04 . Memory (MB): peak = 1427.039 ; gain = 0.000

Phase 3.5 Small Shape Detail Placement
Phase 3.5 Small Shape Detail Placement | Checksum: 1592ba501

Time (s): cpu = 00:00:05 ; elapsed = 00:00:05 . Memory (MB): peak = 1427.039 ; gain = 0.000

Phase 3.6 Re-assign LUT pins
Phase 3.6 Re-assign LUT pins | Checksum: 11cd558c6

Time (s): cpu = 00:00:06 ; elapsed = 00:00:05 . Memory (MB): peak = 1427.039 ; gain = 0.000

Phase 3.7 Pipeline Register Optimization
Phase 3.7 Pipeline Register Optimization | Checksum: 19a784df1

Time (s): cpu = 00:00:06 ; elapsed = 00:00:05 . Memory (MB): peak = 1427.039 ; gain = 0.000
Phase 3 Detail Placement | Checksum: 19a784df1

Time (s): cpu = 00:00:06 ; elapsed = 00:00:05 . Memory (MB): peak = 1427.039 ; gain = 0.000

Phase 4 Post Placement Optimization and Clean-Up

Phase 4.1 Post Commit Optimization
INFO: [Timing 38-35] Done setting XDC timing constraints.

Phase 4.1.1 Post Placement Optimization
Post Placement Optimization Initialization | Checksum: 585bb7ad

Phase 4.1.1.1 BUFG Insertion
INFO: [Place 46-46] BUFG insertion identified 0 candidate nets, 0 success, 0 bufg driver replicated, 0 skipped for placement/routing, 0 skipped for timing, 0 skipped for netlist change reason
Phase 4.1.1.1 BUFG Insertion | Checksum: 585bb7ad

Time (s): cpu = 00:00:06 ; elapsed = 00:00:05 . Memory (MB): peak = 1427.039 ; gain = 0.000
INFO: [Place 30-746] Post Placement Timing Summary WNS=6.955. For the most accurate timing information please run report_timing.
Phase 4.1.1 Post Placement Optimization | Checksum: 65690d88

Time (s): cpu = 00:00:06 ; elapsed = 00:00:05 . Memory (MB): peak = 1427.039 ; gain = 0.000
Phase 4.1 Post Commit Optimization | Checksum: 65690d88

Time (s): cpu = 00:00:06 ; elapsed = 00:00:05 . Memory (MB): peak = 1427.039 ; gain = 0.000

Phase 4.2 Post Placement Cleanup
Phase 4.2 Post Placement Cleanup | Checksum: 65690d88

Time (s): cpu = 00:00:06 ; elapsed = 00:00:05 . Memory (MB): peak = 1427.039 ; gain = 0.000

Phase 4.3 Placer Reporting
Phase 4.3 Placer Reporting | Checksum: 65690d88

Time (s): cpu = 00:00:06 ; elapsed = 00:00:05 . Memory (MB): peak = 1427.039 ; gain = 0.000

Phase 4.4 Final Placement Cleanup
Netlist sorting complete. Time (s): cpu = 00:00:00 ; elapsed = 00:00:00 . Memory (MB): peak = 1427.039 ; gain = 0.000
Phase 4.4 Final Placement Cleanup | Checksum: 112884b97

Time (s): cpu = 00:00:06 ; elapsed = 00:00:05 . Memory (MB): peak = 1427.039 ; gain = 0.000
Phase 4 Post Placement Optimization and Clean-Up | Checksum: 112884b97

Time (s): cpu = 00:00:06 ; elapsed = 00:00:05 . Memory (MB): peak = 1427.039 ; gain = 0.000
Ending Placer Task | Checksum: d3ded89e

Time (s): cpu = 00:00:06 ; elapsed = 00:00:05 . Memory (MB): peak = 1427.039 ; gain = 0.000
INFO: [Common 17-83] Releasing license: Implementation
58 Infos, 0 Warnings, 0 Critical Warnings and 0 Errors encountered.
place_design completed successfully
place_design: Time (s): cpu = 00:00:08 ; elapsed = 00:00:06 . Memory (MB): peak = 1427.039 ; gain = 0.000
Netlist sorting complete. Time (s): cpu = 00:00:00 ; elapsed = 00:00:00.001 . Memory (MB): peak = 1427.039 ; gain = 0.000
INFO: [Timing 38-480] Writing timing data to binary archive.
Writing placer database...
Writing XDEF routing.
Netlist sorting complete. Time (s): cpu = 00:00:00 ; elapsed = 00:00:00 . Memory (MB): peak = 1427.039 ; gain = 0.000
Writing XDEF routing logical nets.
Writing XDEF routing special nets.
Write XDEF Complete: Time (s): cpu = 00:00:01 ; elapsed = 00:00:00.155 . Memory (MB): peak = 1427.039 ; gain = 0.000
INFO: [Common 17-1381] The checkpoint 'C:/Users/c170095/Downloads/Lab5/Lab5/Lab 5/Lab 5.runs/impl_1/uP16_BASYS3_top_placed.dcp' has been generated.
INFO: [runtcl-4] Executing : report_io -file uP16_BASYS3_top_io_placed.rpt
report_io: Time (s): cpu = 00:00:00 ; elapsed = 00:00:00.066 . Memory (MB): peak = 1427.039 ; gain = 0.000
INFO: [runtcl-4] Executing : report_utilization -file uP16_BASYS3_top_utilization_placed.rpt -pb uP16_BASYS3_top_utilization_placed.pb
INFO: [runtcl-4] Executing : report_control_sets -verbose -file uP16_BASYS3_top_control_sets_placed.rpt
report_control_sets: Time (s): cpu = 00:00:00 ; elapsed = 00:00:00.005 . Memory (MB): peak = 1427.039 ; gain = 0.000
Command: route_design
Attempting to get a license for feature 'Implementation' and/or device 'xc7a35t'
INFO: [Common 17-349] Got license for feature 'Implementation' and/or device 'xc7a35t'
Running DRC as a precondition to command route_design
INFO: [DRC 23-27] Running DRC with 2 threads
INFO: [Vivado_Tcl 4-198] DRC finished with 0 Errors
INFO: [Vivado_Tcl 4-199] Please refer to the DRC report (report_drc) for more information.


Starting Routing Task
INFO: [Route 35-254] Multithreading enabled for route_design using a maximum of 2 CPUs
Checksum: PlaceDB: c872e3e ConstDB: 0 ShapeSum: c757aa60 RouteDB: 0

Phase 1 Build RT Design
Phase 1 Build RT Design | Checksum: bf343fc1

Time (s): cpu = 00:00:30 ; elapsed = 00:00:27 . Memory (MB): peak = 1445.242 ; gain = 18.203
Post Restoration Checksum: NetGraph: b6d3ae31 NumContArr: 8609190 Constraints: 0 Timing: 0

Phase 2 Router Initialization

Phase 2.1 Create Timer
Phase 2.1 Create Timer | Checksum: bf343fc1

Time (s): cpu = 00:00:30 ; elapsed = 00:00:27 . Memory (MB): peak = 1477.523 ; gain = 50.484

Phase 2.2 Fix Topology Constraints
Phase 2.2 Fix Topology Constraints | Checksum: bf343fc1

Time (s): cpu = 00:00:30 ; elapsed = 00:00:27 . Memory (MB): peak = 1483.555 ; gain = 56.516

Phase 2.3 Pre Route Cleanup
Phase 2.3 Pre Route Cleanup | Checksum: bf343fc1

Time (s): cpu = 00:00:30 ; elapsed = 00:00:27 . Memory (MB): peak = 1483.555 ; gain = 56.516
 Number of Nodes with overlaps = 0

Phase 2.4 Update Timing
Phase 2.4 Update Timing | Checksum: 1bf85ff23

Time (s): cpu = 00:00:30 ; elapsed = 00:00:27 . Memory (MB): peak = 1489.340 ; gain = 62.301
INFO: [Route 35-416] Intermediate Timing Summary | WNS=6.715  | TNS=0.000  | WHS=0.004  | THS=0.000  |

Phase 2 Router Initialization | Checksum: 1921c4c35

Time (s): cpu = 00:00:30 ; elapsed = 00:00:27 . Memory (MB): peak = 1489.340 ; gain = 62.301

Phase 3 Initial Routing
Phase 3 Initial Routing | Checksum: 2b0b00cc0

Time (s): cpu = 00:00:31 ; elapsed = 00:00:28 . Memory (MB): peak = 1489.340 ; gain = 62.301

Phase 4 Rip-up And Reroute

Phase 4.1 Global Iteration 0
 Number of Nodes with overlaps = 48
 Number of Nodes with overlaps = 0
INFO: [Route 35-416] Intermediate Timing Summary | WNS=6.713  | TNS=0.000  | WHS=N/A    | THS=N/A    |

Phase 4.1 Global Iteration 0 | Checksum: 20c642a21

Time (s): cpu = 00:00:31 ; elapsed = 00:00:28 . Memory (MB): peak = 1489.340 ; gain = 62.301
Phase 4 Rip-up And Reroute | Checksum: 20c642a21

Time (s): cpu = 00:00:31 ; elapsed = 00:00:28 . Memory (MB): peak = 1489.340 ; gain = 62.301

Phase 5 Delay and Skew Optimization

Phase 5.1 Delay CleanUp
Phase 5.1 Delay CleanUp | Checksum: 20c642a21

Time (s): cpu = 00:00:31 ; elapsed = 00:00:28 . Memory (MB): peak = 1489.340 ; gain = 62.301

Phase 5.2 Clock Skew Optimization
Phase 5.2 Clock Skew Optimization | Checksum: 20c642a21

Time (s): cpu = 00:00:31 ; elapsed = 00:00:28 . Memory (MB): peak = 1489.340 ; gain = 62.301
Phase 5 Delay and Skew Optimization | Checksum: 20c642a21

Time (s): cpu = 00:00:31 ; elapsed = 00:00:28 . Memory (MB): peak = 1489.340 ; gain = 62.301

Phase 6 Post Hold Fix

Phase 6.1 Hold Fix Iter

Phase 6.1.1 Update Timing
Phase 6.1.1 Update Timing | Checksum: 169d30d8f

Time (s): cpu = 00:00:31 ; elapsed = 00:00:28 . Memory (MB): peak = 1489.340 ; gain = 62.301
INFO: [Route 35-416] Intermediate Timing Summary | WNS=6.807  | TNS=0.000  | WHS=0.306  | THS=0.000  |

Phase 6.1 Hold Fix Iter | Checksum: 169d30d8f

Time (s): cpu = 00:00:31 ; elapsed = 00:00:28 . Memory (MB): peak = 1489.340 ; gain = 62.301
Phase 6 Post Hold Fix | Checksum: 169d30d8f

Time (s): cpu = 00:00:31 ; elapsed = 00:00:28 . Memory (MB): peak = 1489.340 ; gain = 62.301

Phase 7 Route finalize

Router Utilization Summary
  Global Vertical Routing Utilization    = 0.117994 %
  Global Horizontal Routing Utilization  = 0.165799 %
  Routable Net Status*
  *Does not include unroutable nets such as driverless and loadless.
  Run report_route_status for detailed report.
  Number of Failed Nets               = 0
  Number of Unrouted Nets             = 0
  Number of Partially Routed Nets     = 0
  Number of Node Overlaps             = 0

Phase 7 Route finalize | Checksum: 169d30d8f

Time (s): cpu = 00:00:31 ; elapsed = 00:00:28 . Memory (MB): peak = 1489.340 ; gain = 62.301

Phase 8 Verifying routed nets

 Verification completed successfully
Phase 8 Verifying routed nets | Checksum: 169d30d8f

Time (s): cpu = 00:00:31 ; elapsed = 00:00:28 . Memory (MB): peak = 1489.789 ; gain = 62.750

Phase 9 Depositing Routes
Phase 9 Depositing Routes | Checksum: 1461aa3df

Time (s): cpu = 00:00:31 ; elapsed = 00:00:28 . Memory (MB): peak = 1489.789 ; gain = 62.750

Phase 10 Post Router Timing
INFO: [Route 35-57] Estimated Timing Summary | WNS=6.807  | TNS=0.000  | WHS=0.306  | THS=0.000  |

INFO: [Route 35-327] The final timing numbers are based on the router estimated timing analysis. For a complete and accurate timing signoff, please run report_timing_summary.
Phase 10 Post Router Timing | Checksum: 1461aa3df

Time (s): cpu = 00:00:31 ; elapsed = 00:00:28 . Memory (MB): peak = 1489.789 ; gain = 62.750
INFO: [Route 35-16] Router Completed Successfully

Time (s): cpu = 00:00:31 ; elapsed = 00:00:28 . Memory (MB): peak = 1489.789 ; gain = 62.750

Routing Is Done.
INFO: [Common 17-83] Releasing license: Implementation
75 Infos, 0 Warnings, 0 Critical Warnings and 0 Errors encountered.
route_design completed successfully
route_design: Time (s): cpu = 00:00:33 ; elapsed = 00:00:29 . Memory (MB): peak = 1489.789 ; gain = 62.750
Netlist sorting complete. Time (s): cpu = 00:00:00 ; elapsed = 00:00:00 . Memory (MB): peak = 1489.789 ; gain = 0.000
INFO: [Timing 38-480] Writing timing data to binary archive.
Writing placer database...
Writing XDEF routing.
Netlist sorting complete. Time (s): cpu = 00:00:00 ; elapsed = 00:00:00.001 . Memory (MB): peak = 1489.789 ; gain = 0.000
Writing XDEF routing logical nets.
Writing XDEF routing special nets.
Write XDEF Complete: Time (s): cpu = 00:00:01 ; elapsed = 00:00:00.183 . Memory (MB): peak = 1489.789 ; gain = 0.000
INFO: [Common 17-1381] The checkpoint 'C:/Users/c170095/Downloads/Lab5/Lab5/Lab 5/Lab 5.runs/impl_1/uP16_BASYS3_top_routed.dcp' has been generated.
INFO: [runtcl-4] Executing : report_drc -file uP16_BASYS3_top_drc_routed.rpt -pb uP16_BASYS3_top_drc_routed.pb -rpx uP16_BASYS3_top_drc_routed.rpx
Command: report_drc -file uP16_BASYS3_top_drc_routed.rpt -pb uP16_BASYS3_top_drc_routed.pb -rpx uP16_BASYS3_top_drc_routed.rpx
INFO: [IP_Flow 19-1839] IP Catalog is up to date.
INFO: [DRC 23-27] Running DRC with 2 threads
INFO: [Coretcl 2-168] The results of DRC are in file C:/Users/c170095/Downloads/Lab5/Lab5/Lab 5/Lab 5.runs/impl_1/uP16_BASYS3_top_drc_routed.rpt.
report_drc completed successfully
INFO: [runtcl-4] Executing : report_methodology -file uP16_BASYS3_top_methodology_drc_routed.rpt -pb uP16_BASYS3_top_methodology_drc_routed.pb -rpx uP16_BASYS3_top_methodology_drc_routed.rpx
Command: report_methodology -file uP16_BASYS3_top_methodology_drc_routed.rpt -pb uP16_BASYS3_top_methodology_drc_routed.pb -rpx uP16_BASYS3_top_methodology_drc_routed.rpx
INFO: [Timing 38-35] Done setting XDC timing constraints.
INFO: [DRC 23-133] Running Methodology with 2 threads
INFO: [Coretcl 2-1520] The results of Report Methodology are in file C:/Users/c170095/Downloads/Lab5/Lab5/Lab 5/Lab 5.runs/impl_1/uP16_BASYS3_top_methodology_drc_routed.rpt.
report_methodology completed successfully
INFO: [runtcl-4] Executing : report_power -file uP16_BASYS3_top_power_routed.rpt -pb uP16_BASYS3_top_power_summary_routed.pb -rpx uP16_BASYS3_top_power_routed.rpx
Command: report_power -file uP16_BASYS3_top_power_routed.rpt -pb uP16_BASYS3_top_power_summary_routed.pb -rpx uP16_BASYS3_top_power_routed.rpx
INFO: [Timing 38-35] Done setting XDC timing constraints.
Running Vector-less Activity Propagation...

Finished Running Vector-less Activity Propagation
87 Infos, 0 Warnings, 0 Critical Warnings and 0 Errors encountered.
report_power completed successfully
INFO: [runtcl-4] Executing : report_route_status -file uP16_BASYS3_top_route_status.rpt -pb uP16_BASYS3_top_route_status.pb
INFO: [runtcl-4] Executing : report_timing_summary -max_paths 10 -file uP16_BASYS3_top_timing_summary_routed.rpt -pb uP16_BASYS3_top_timing_summary_routed.pb -rpx uP16_BASYS3_top_timing_summary_routed.rpx -warn_on_violation 
INFO: [Timing 38-91] UpdateTimingParams: Speed grade: -1, Delay Type: min_max.
INFO: [Timing 38-191] Multithreading enabled for timing update using a maximum of 2 CPUs
INFO: [runtcl-4] Executing : report_incremental_reuse -file uP16_BASYS3_top_incremental_reuse_routed.rpt
INFO: [Vivado_Tcl 4-1062] Incremental flow is disabled. No incremental reuse Info to report.
INFO: [runtcl-4] Executing : report_clock_utilization -file uP16_BASYS3_top_clock_utilization_routed.rpt
INFO: [runtcl-4] Executing : report_bus_skew -warn_on_violation -file uP16_BASYS3_top_bus_skew_routed.rpt -pb uP16_BASYS3_top_bus_skew_routed.pb -rpx uP16_BASYS3_top_bus_skew_routed.rpx
INFO: [Timing 38-91] UpdateTimingParams: Speed grade: -1, Delay Type: min_max.
INFO: [Timing 38-191] Multithreading enabled for timing update using a maximum of 2 CPUs
INFO: [Common 17-206] Exiting Vivado at Tue Apr 13 14:27:06 2021...

*** Running vivado
    with args -log uP16_BASYS3_top.vdi -applog -m64 -product Vivado -messageDb vivado.pb -mode batch -source uP16_BASYS3_top.tcl -notrace


****** Vivado v2018.3 (64-bit)
  **** SW Build 2405991 on Thu Dec  6 23:38:27 MST 2018
  **** IP Build 2404404 on Fri Dec  7 01:43:56 MST 2018
    ** Copyright 1986-2018 Xilinx, Inc. All Rights Reserved.

source uP16_BASYS3_top.tcl -notrace
Command: open_checkpoint uP16_BASYS3_top_routed.dcp

Starting open_checkpoint Task

Time (s): cpu = 00:00:00 ; elapsed = 00:00:00.053 . Memory (MB): peak = 249.723 ; gain = 0.000
INFO: [Netlist 29-17] Analyzing 68 Unisim elements for replacement
INFO: [Netlist 29-28] Unisim Transformation completed in 0 CPU seconds
INFO: [Project 1-479] Netlist was created with Vivado 2018.3
INFO: [Device 21-403] Loading part xc7a35tcpg236-1
INFO: [Project 1-570] Preparing netlist for logic optimization
INFO: [Timing 38-478] Restoring timing data from binary archive.
INFO: [Timing 38-479] Binary timing data restore complete.
INFO: [Project 1-856] Restoring constraints from binary archive.
INFO: [Project 1-853] Binary constraint restore complete.
Reading XDEF placement.
Reading placer database...
Reading XDEF routing.
Read XDEF File: Time (s): cpu = 00:00:00 ; elapsed = 00:00:00.259 . Memory (MB): peak = 1212.551 ; gain = 2.570
Restored from archive | CPU: 0.000000 secs | Memory: 0.000000 MB |
Finished XDEF File Restore: Time (s): cpu = 00:00:00 ; elapsed = 00:00:00.260 . Memory (MB): peak = 1212.551 ; gain = 2.570
Netlist sorting complete. Time (s): cpu = 00:00:00 ; elapsed = 00:00:00.001 . Memory (MB): peak = 1212.551 ; gain = 0.000
INFO: [Project 1-111] Unisim Transformation Summary:
No Unisim elements were transformed.

INFO: [Project 1-604] Checkpoint was created with Vivado v2018.3 (64-bit) build 2405991
open_checkpoint: Time (s): cpu = 00:00:23 ; elapsed = 00:00:25 . Memory (MB): peak = 1212.551 ; gain = 962.828
Command: write_bitstream -force uP16_BASYS3_top.bit
Attempting to get a license for feature 'Implementation' and/or device 'xc7a35t'
INFO: [Common 17-349] Got license for feature 'Implementation' and/or device 'xc7a35t'
Running DRC as a precondition to command write_bitstream
INFO: [IP_Flow 19-234] Refreshing IP repositories
INFO: [IP_Flow 19-1704] No user IP repositories specified
INFO: [IP_Flow 19-2313] Loaded Vivado IP repository 'C:/Xilinx/Vivado/2018.3/data/ip'.
INFO: [DRC 23-27] Running DRC with 2 threads
INFO: [Vivado 12-3199] DRC finished with 0 Errors
INFO: [Vivado 12-3200] Please refer to the DRC report (report_drc) for more information.
INFO: [Designutils 20-2272] Running write_bitstream with 2 threads.
Loading data files...
Loading site data...
Loading route data...
Processing options...
Creating bitmap...
Creating bitstream...
Writing bitstream ./uP16_BASYS3_top.bit...
INFO: [Vivado 12-1842] Bitgen Completed Successfully.
INFO: [Common 17-83] Releasing license: Implementation
21 Infos, 0 Warnings, 0 Critical Warnings and 0 Errors encountered.
write_bitstream completed successfully
write_bitstream: Time (s): cpu = 00:01:03 ; elapsed = 00:01:01 . Memory (MB): peak = 1690.734 ; gain = 478.184
INFO: [Common 17-206] Exiting Vivado at Tue Apr 13 14:29:00 2021...
